{"schema_version":1,"protocol_version":"1.0","task_id":"insect-release-r4d8","title":"Audit and qualify insect desktop release","objective":"Continue authoritative Tasks06-16 PreFinal archive, fix remaining regressions, implement Tasks17-20 and report measured native and hardware gates honestly","created_by":"astra-insect-release-r4d8","created_at":"2026-09-18T14:34:00+00:00","priority":"high","status":"open","scopes":["projects/insect-realism-desktop-app",".github/workflows/insect-release.yml"],"acceptance_criteria":["Evidence gate, release tests, profile validation, performance instrumentation and stress/soak artifacts","Reproducible platform packaging and explicit native runtime acceptance status","Checkpoint source and verification preserved before handoff"]}
