{
  "schema_version": 1,
  "protocol_version": "1.0",
  "task_id": "insect-research-audit-20260919-r3",
  "title": "Audit and correct insect research R3",
  "objective": "Quad-check R2 source identity, quantitative parameters, life-stage directness, dataset bytes/checksums, and implementation conclusions; publish a corrected audited R3 without modifying verified runtime code.",
  "created_by": "sol-insect-audit-r3",
  "created_at": "2026-09-19T05:42:00+00:00",
  "priority": "critical",
  "status": "completed",
  "scopes": [
    "projects/insect-realism-desktop-app/research/secondary-insects"
  ],
  "acceptance_criteria": [
    "Every cited source ID resolves and duplicate records are canonically identified",
    "Every quantitative parameter is classified by directness, life stage, experimental context, and source support",
    "Known source/PMID/title mismatches and life-stage mislabels are corrected or removed",
    "Raw empirical companion bytes and cryptographic hashes are reverified",
    "R3 checksum manifests describe only files actually present in each delivered artifact",
    "Unsupported precision, cross-stage transfer, and pseudo-scientific candidate scoring are removed",
    "Verified application/runtime code remains untouched"
  ]
}
