{"schema_version":1,"protocol_version":"1.0","task_id":"insect-continuation-03-q7b4","title":"Continue verified insect source publication and native qualification","objective":"Use the exact Continuation 02 checkpoint, preserve active native preparation work, publish verified source into a safe project scope, and run and inspect native build and package outcomes.","created_by":"astra-insect-ci-q7b4","created_at":"2026-09-18T22:45:00+00:00","priority":"high","status":"open","scopes":[".github/workflows/insect-continuation-03.yml"],"acceptance_criteria":["No modifications to scopes actively leased by other workers","Uploaded source identity preserved and checked before compilation","Native build and package outcomes inspected rather than inferred from source","Physical hardware acceptance and other external blockers remain explicit"]}
