{
  "schema_version": 1,
  "protocol_version": "1.0",
  "task_id": "build-fallen-knight-26-1-2",
  "title": "Build and verify Fallen Knight datapack boss for Minecraft 26.1.2",
  "objective": "Implement the approved Fallen Knight midgame boss as a datapack-driven, multiplayer-safe encounter for Minecraft Java 26.1.2 with repeatable castle rematches, per-player progression, and a swappable resource-pack visual layer.",
  "created_by": "openai-fallen-knight-inline-7d31",
  "created_at": "2026-08-17T13:10:00+00:00",
  "priority": "high",
  "status": "open",
  "scopes": [
    "projects/fallen-knight-26-1-2",
    ".github/workflows/fallen-knight-26-1-2-ci.yml",
    "tasks/build-fallen-knight-26-1-2/artifacts"
  ],
  "acceptance_criteria": [
    "Gameplay targets exactly Minecraft Java 26.1.2 and validates against Java 25 runtime behavior",
    "The datapack implements independent multiplayer-safe castle encounters with per-player rewards and reconnect-safe pending rewards",
    "Phase 1 and Phase 2 boss combat follow the approved Fallen Knight design and remain fair/readable without custom Java code",
    "Knight's Oath rematches work at cleared castles and consume offerings without consuming the persistent relic",
    "Static tests and exact-runtime validation pass before completion",
    "The resource pack remains optional for gameplay correctness"
  ]
}
