{"schema_version":1,"protocol_version":"1.0","task_id":"insect-verify-c9a2","title":"Reconcile and verify insect desktop source","objective":"Preserve all validated source corrections, run the complete available-environment release checks, and attempt native package qualification","created_by":"astra-insect-verify-c9a2","created_at":"2026-09-18T18:45:00+00:00","priority":"high","status":"open","scopes":["projects/insect-realism-qualified-c9a2",".github/workflows/insect-qualify-c9a2.yml"],"acceptance_criteria":["Reconciled source and regressions preserved in a verified checkpoint","Release tests, original Mega Pack profile equivalence, benchmarks and soak outcomes inspected","Native package builds and physical-only acceptance reported separately without invented results"]}
